{
  "$schema": "ui-spec/ui-release-manifest.schema.json",
  "schemaVersion": 1,
  "version": "4.0.0",
  "hashAlgorithm": "sha256",
  "files": [
    {
      "path": "Package.swift",
      "byteLength": 1786,
      "sha256": "29044755420febef87da85053b4c91ef4048639c14b93c06a9b3ff89d3bd65f9"
    },
    {
      "path": "build.gradle.kts",
      "byteLength": 155,
      "sha256": "0c67bfe1f11ca83049ee3f21952e377755345da941d0c4cce80f0c8952cae36d"
    },
    {
      "path": "contracts/VERSION.json",
      "byteLength": 35880,
      "sha256": "6c9a8938c9461ae8a667d9bba1a148003c1b2d6b47cb633785ff8468174ca0be"
    },
    {
      "path": "contracts/appearance.schema.json",
      "byteLength": 4531,
      "sha256": "97cd58ff747ea44ab22aeb7e0c9c15c7644deb3b748b5534fa882430be0ec9ae"
    },
    {
      "path": "contracts/content.schema.json",
      "byteLength": 2887,
      "sha256": "b1895f4fbcf527b89551c6cce12ba0a55e69e01460cd039e73e2149ba67bd717"
    },
    {
      "path": "contracts/control-identity.schema.json",
      "byteLength": 13423,
      "sha256": "feb87a6e66d3005bb85f934fd24ebaa26d685a1b6f869869eb091e1366eef252"
    },
    {
      "path": "contracts/core-command.schema.json",
      "byteLength": 3226,
      "sha256": "fc07442efbf2486be4f1fb2a04d03b4f8a897959aa51fce2a03241477aba8d72"
    },
    {
      "path": "contracts/core-event.schema.json",
      "byteLength": 4457,
      "sha256": "48f048437a0898ebe46e285b419627377e531a8c41141edc65125abfc6caabaa"
    },
    {
      "path": "contracts/design-delta.schema.json",
      "byteLength": 9070,
      "sha256": "a7a804141fbe25b2772e92876173628a0b57f75e89683903459310489bb58736"
    },
    {
      "path": "contracts/device-conformance-evidence.schema.json",
      "byteLength": 5556,
      "sha256": "cf7d8c26be704e8e7b502edd7c4064ff010e920dfd8c2652c98ada12e154034c"
    },
    {
      "path": "contracts/device-conformance-plan.schema.json",
      "byteLength": 6983,
      "sha256": "61a1ee6aaf7086c94033ad0dda5ca3276ad414b4e93e48cb09b4d36c16c3ca33"
    },
    {
      "path": "contracts/fixtures/appearance.fixtures.json",
      "byteLength": 4912,
      "sha256": "bd0f897c45404562553622cf6295f0a9dd4cb25587bd8b536528603619630892"
    },
    {
      "path": "contracts/fixtures/content.fixtures.json",
      "byteLength": 1982,
      "sha256": "9e06eb424ed4e0eedb51ae5c825cc97c08e18ad1f3245c5de82b60de0787a3f9"
    },
    {
      "path": "contracts/fixtures/core-command.fixtures.json",
      "byteLength": 7637,
      "sha256": "45c0bb8d3206751977f4890ba0f53a5850ebcf97c6f26de3965c83adece5f4ae"
    },
    {
      "path": "contracts/fixtures/core-event.fixtures.json",
      "byteLength": 5938,
      "sha256": "1e094526f74343c8b13787d6bbb39425b60114d861dbc4d656ab69b8be1fcb8d"
    },
    {
      "path": "contracts/fixtures/design-delta.fixtures.json",
      "byteLength": 3523,
      "sha256": "18ac67e0c50e3d1c78a795cbeff547e9e3d00f538a825dbd03663ddbdd737998"
    },
    {
      "path": "contracts/fixtures/host-request.fixtures.json",
      "byteLength": 8855,
      "sha256": "27200293dd75a1feb39a32d6658c06a1762e23f5b694e51d1c6e67fdcdea85ca"
    },
    {
      "path": "contracts/fixtures/host-result.fixtures.json",
      "byteLength": 7939,
      "sha256": "547bd36f2bd6ee26600cccab6507e2a536fd2a02fa5a2af871cb5eeefab081b1"
    },
    {
      "path": "contracts/fixtures/motion-policy.fixtures.json",
      "byteLength": 12733,
      "sha256": "5982a6140e1c23c28dbda5c208ec0ed41699f07a595d1e41338c0b8794275d11"
    },
    {
      "path": "contracts/fixtures/motion.fixtures.json",
      "byteLength": 105088,
      "sha256": "3b68c57171dbbdf68426f695ab536540c47127227817f87a9f9a7a924c2c8c91"
    },
    {
      "path": "contracts/fixtures/platform-evidence-manifest.fixtures.json",
      "byteLength": 8996,
      "sha256": "236538cefa3dd714e8fd5aa46ac5aa6365fb9a5c12930c7b7a34183829473701"
    },
    {
      "path": "contracts/fixtures/product-capability.fixtures.json",
      "byteLength": 48689,
      "sha256": "2a61e9f8a2f651d15098cf758a202cca706ad1c85465e6f6ac428b6094c083a9"
    },
    {
      "path": "contracts/fixtures/progress-location.fixtures.json",
      "byteLength": 1976,
      "sha256": "1ff2398895ecfd3844eaa6e1c291afe1cf42cdd97bcc6f74f07417cf3c110c20"
    },
    {
      "path": "contracts/fixtures/route.fixtures.json",
      "byteLength": 25340,
      "sha256": "546e3a84d3f0d9c3e421baa4809bde3c98829958daddf710617a6edaa6bf9672"
    },
    {
      "path": "contracts/fixtures/runtime-payload-contract.fixtures.json",
      "byteLength": 51616,
      "sha256": "eb6454a020c0a8d5ca47bcf9eeaca34a477440ad5abbd640c2d95cdca5ed6159"
    },
    {
      "path": "contracts/fixtures/runtime-payload-contract.fixtures.schema.json",
      "byteLength": 511,
      "sha256": "4a262b1736422edb85c3b12730dcf69d4a1436fa462909844a838e06ea223f39"
    },
    {
      "path": "contracts/fixtures/runtime-result-contract.fixtures.json",
      "byteLength": 54814,
      "sha256": "1cbf02d797b41faab13ffc9ca12dff27ea6397448e71a6bbdc65ef516256712d"
    },
    {
      "path": "contracts/fixtures/runtime-result-contract.fixtures.schema.json",
      "byteLength": 580,
      "sha256": "c55323efa486cffdf1617f9289ccb828fa3e44f152a8e761528e41ae562cb29f"
    },
    {
      "path": "contracts/fixtures/state-rule.fixtures.json",
      "byteLength": 7498,
      "sha256": "67be3bceb17aa96ca17df2a13603a46adb031c528d7c4b1f97052bde0b952a0d"
    },
    {
      "path": "contracts/fixtures/sync-conflict.fixtures.json",
      "byteLength": 2897,
      "sha256": "10a49107acd148105b7b9a17bfe831b84844024ff618ffccd773fd11c44d9b86"
    },
    {
      "path": "contracts/fixtures/token.fixtures.json",
      "byteLength": 38380,
      "sha256": "ccc68acf70ff6560a322a11c4e04e422cc883cbd32e12912d21da7aba689ad61"
    },
    {
      "path": "contracts/fixtures/ui-event.fixtures.json",
      "byteLength": 18615,
      "sha256": "6b71fd584902c7537eadf49cd7d5ae5be3c1b2af9808d4f8d8e91b6f95e5ea32"
    },
    {
      "path": "contracts/fixtures/ui-state.fixtures.json",
      "byteLength": 21040,
      "sha256": "444f0fd9baa710e39b9ca934da1abcbb1f8e089b02e869f595702d8e191d7d2d"
    },
    {
      "path": "contracts/fixtures/view-state.fixtures.json",
      "byteLength": 170815,
      "sha256": "a055365332288ad8c233a221a9c24a9dc91ec95bd7d94df4b4b9ae6105925c84"
    },
    {
      "path": "contracts/host-request.schema.json",
      "byteLength": 31494,
      "sha256": "39fa3556a6f2dd9ec814b5db75462eeb9e0d5ab920351986f6600fc063cfd89d"
    },
    {
      "path": "contracts/host-result.schema.json",
      "byteLength": 30846,
      "sha256": "019d97f7b72d7d13e2a3f7b53184f1629e98ab7927444a699f9190a4f6ea2d4d"
    },
    {
      "path": "contracts/motion-policy.schema.json",
      "byteLength": 7423,
      "sha256": "89e2c7f266e77befddf09d814edc7fa6cc8006702c4bd2e48b5a8b4c630fa594"
    },
    {
      "path": "contracts/motion.schema.json",
      "byteLength": 14697,
      "sha256": "aa4a3edf2daf89342413dc91a6b5948d68af605f1cdc94808f953243bde93c76"
    },
    {
      "path": "contracts/platform-evidence-manifest.schema.json",
      "byteLength": 12395,
      "sha256": "8f7fb60d5133294485b1303a61c966c705bcb9b00e48f46604ef0d4729f42027"
    },
    {
      "path": "contracts/product-capability.schema.json",
      "byteLength": 5050,
      "sha256": "28aaedcacb9c70570fd53c0247b8c76e6d67e71ef9871ff40fb8feb74daaf5f5"
    },
    {
      "path": "contracts/progress-location.schema.json",
      "byteLength": 2853,
      "sha256": "43909cca27a5ca4b25dbedce6d93b736d5c06ea824307d1e60837ec27bde5844"
    },
    {
      "path": "contracts/route.schema.json",
      "byteLength": 9845,
      "sha256": "6e3746c4666ad3571973e5ca3812508abf83dca47646c437608e3b1c50d28de5"
    },
    {
      "path": "contracts/state-rule.schema.json",
      "byteLength": 6826,
      "sha256": "74d99eb6049eedbd660473d94b1ec02bdbd8d15a0d357e17cb452e3504cb62fc"
    },
    {
      "path": "contracts/sync-conflict.schema.json",
      "byteLength": 2178,
      "sha256": "c361a4b152ff48b9496a17eedc05dae2ab972cf33b9b3a9dacb5c6a10292410b"
    },
    {
      "path": "contracts/token.schema.json",
      "byteLength": 6954,
      "sha256": "27c07b387b10a262c3c74b1b619d7498c077ebbabc847c148a74f959e22694be"
    },
    {
      "path": "contracts/ui-event.schema.json",
      "byteLength": 11167,
      "sha256": "9a1b679244ffd4bcd7d7f7e78d9d3ef31f9720c9da1c2e28ed91d32621e98988"
    },
    {
      "path": "contracts/ui-state.schema.json",
      "byteLength": 14740,
      "sha256": "c596f65f9b8d5008860d43acc1876f0165273ebcddbaf62f561be4bf96d9d6e8"
    },
    {
      "path": "contracts/view-state.schema.json",
      "byteLength": 10720,
      "sha256": "65a6a7a8bac825ac432f361ae05f66a72275bc48e40b5bd4000fd06b7f14b0ff"
    },
    {
      "path": "device-conformance/DEVICE_CONFORMANCE_PLAN.json",
      "byteLength": 155698,
      "sha256": "9e7fdaf5cdec6c2684f212aba230d8a05ef3c3606e53bbe386be3fde64fd5663"
    },
    {
      "path": "frontend-demo-optimized/appearance-spec.js",
      "byteLength": 6606,
      "sha256": "aefc5c4cbca88fb7e005a86fc8b8754c2c63d3bdcc7fe223789af25af2aaa648"
    },
    {
      "path": "frontend-demo-optimized/asset-library/asset-library.css",
      "byteLength": 5558,
      "sha256": "56703bb23d4d53d58297ad460daca0e1e3e7a5d310460c6de88c057ee2c8ab4a"
    },
    {
      "path": "frontend-demo-optimized/asset-library/fixture.json",
      "byteLength": 7032,
      "sha256": "336708878bd1f3e0645930d3c1eedc072c9a4122fcd0c6b897ba0f9fdd8eabb5"
    },
    {
      "path": "frontend-demo-optimized/asset-library/icons.js",
      "byteLength": 97343,
      "sha256": "f149f681e9c9aee99850db9a2fc023705cd0ad3911ac60c1065de3e350db1b48"
    },
    {
      "path": "frontend-demo-optimized/asset-library/icons/tabler/3.44.0/LICENSE.txt",
      "byteLength": 1073,
      "sha256": "b740a1d46122672da62833e97f7e7c8a13fa85cbc7445b584b297cc00dde93db"
    },
    {